Name,Rating,Address,URL,Price,Type,Phone,Cousine,Meals
Layali El Sham Restaurant,4.5 ,"Swiss Garden Residence 6th Floor, 117, Kuala Lumpur 55100 Malaysia",https://www.facebook.com/layalielsham.res/,$$ - $$$,$$ - $$$TurkishMiddle EasternArabic,+60 16-243 4743,"Vegan Options, Vegetarian Friendly, Halal","Breakfast, Lunch, Dinner, Brunch, After-hours, Drinks"
Joloko,4.5 ,"43 Jalan Kamunting Chow Kit, Kuala Lumpur 50300 Malaysia",http://www.bar-joloko.com/,$$ - $$$,$$ - $$$CaribbeanJamaican,+60 3-2694 1100,"Caribbean, Jamaican","Dinner, Lunch, After-hours, Drinks"
Neroteca,4.0 ,"8 Lorong Ceylon Unit G-1, Kuala Lumpur 50250 Malaysia",http://www.neroteca.com/,$$ - $$$,$$ - $$$ItalianPizzaEuropean,+60 3-2070 0530,Vegetarian Friendly,"Lunch, Dinner, Brunch, Drinks"
Serendib Restaurant & Bar,4.5 ,"GTower 199 Jalan Tun Razak LG 07 & 08 GTower, Kuala Lumpur 50400 Malaysia",http://www.serendib.restaurant/,$$ - $$$,$$ - $$$Sri LankanVegetarian FriendlyVegan Options,+60 3-2181 4647,Sri Lankan,"Vegetarian Friendly, Vegan Options"
Woobar,4.5 ,"121, Jalan Ampang Level 8, W, Kuala Lumpur 50450 Malaysia",https://www.marriott.com/en-us/hotels/kulwh-w-kuala-lumpur/dining/,$$ - $$$,$$ - $$$Quick BitesBarInternational,+60 12-347 9088,,
V88 Chinatown,4.5 ,"34, Jalan Sultan, City Centre, 50000 Kuala Lumpur,, Kuala Lumpur 50000 Malaysia",https://www.instagram.com/v88_chinatown/,$$ - $$$,$$ - $$$Quick BitesCafeAsian,011-5982 7882,"Cafe, Fusion, Malaysian, Asian",Vegan Options
Gem Restaurant,4.0 ,"124 Jalan Tun Sambanthan, Kuala Lumpur 50470 Malaysia",https://www.facebook.com/gemrestklg,$$ - $$$,$$ - $$$IndianAsianVegetarian Friendly,+60 3-2260 1373,"Indian, Asian","Vegetarian Friendly, Vegan Options, Gluten Free Options"
Gordon Ramsay Bar & Grill,4.0 ,"Lobby Level, Sunway Resort Hotel Persiaran Lagoon, Subang Jaya 47500 Malaysia",https://www.sunwayhotels.com/sunway-resort/dining/gordon-ramsay-bar-and-grill,$$$$,$$$$British,+60 3-7492 8000,"Lunch, Dinner","Reservations, Private Dining, Seating, Parking Available, Valet Parking, Serves Alcohol, Accepts Credit Cards, Table Service, Full Bar, Wine and Beer, Free Wifi, Non-smoking restaurants"
Cotta,5.0 ,"Jalan Kiara 5 L6-1A, Verve Shops, 8, Mont Kiara, Kuala Lumpur 50480 Malaysia",https://www.cotta.com.my/,$,$CafeHealthy,+60 11-2321 2125,"Cafe, Healthy","Breakfast, Lunch, Brunch"
Pulp,4.0 ,"29 1, Lorong Riong Bangsar, Kuala Lumpur 59100 Malaysia",http://www.facebook.com/PULPbyPapaPalheta,$$ - $$$,$$ - $$$Quick BitesCafe,+60 3-2201 3650,"Breakfast, Lunch, Brunch","Takeout, Seating, Wheelchair Accessible"
ABC Bistro Cafe,4.0 ,"106 Jalan Tun Sambanthan NU Sentral Mall, Brickfields, Kuala Lumpur 50470 Malaysia",,$,$IndianCafeAsian,,"Vegetarian Friendly, Halal, Vegan Options","Breakfast, Lunch, Dinner, Brunch"
The Beato Aged Steakhouse,4.0 ,"Jalan Dutamas 1 D2-G3-9 Solaris Dutamas, Kuala Lumpur 50480 Malaysia",http://www.beato.com.my/,$$ - $$$,$$ - $$$Steakhouse,+60 10-760 0423,"Lunch, Dinner","Reservations, Seating, Serves Alcohol, Full Bar, Free Wifi, Table Service"
Republic of Food,4.0 ,"Lot 1, 41 00, Level 1 Pavilion, In Pavilion Shopping Complex, Kuala Lumpur 55100 Malaysia",https://www.facebook.com/FoodRepublicMY,$,$Quick BitesFast foodAsian,+60 3-2142 8006,Vegetarian Friendly,"Lunch, Dinner"
The Brasserie - The St. Regis Kuala Lumpur,4.0 ,"No 6 Jalan Stesen Sentral 2 The St. Regis Kuala Lumpur, Kuala Lumpur 50470 Malaysia",https://www.marriott.com/hotels/hotel-information/restaurant/details/kulxr-the-st-regis-kuala-lumpur/5975433/,$$$$,$$$$FrenchEuropeanVegetarian Friendly,+60 3-2727 6666,"French, European","Gluten Free Options, Vegetarian Friendly"
Shucked Oyster and Seafood Bar,4.5 ,"Solaris Dutamas 1 Jalan Dutamas 1 B.I.G. Supermarket, Lower Ground Floor, Publika, Kuala Lumpur 50480 Malaysia",http://www.shuckedoysterbars.com/,$$ - $$$,$$ - $$$SeafoodGluten Free Options,+60 3-6209 1739,Seafood,Gluten Free Options
TasteBud,4.5 ,"834 Jalan Sentul Next to YTL Fennel, D6, D7,Tamarind ,The Saffron, Kuala Lumpur 51000 Malaysia",http://tastebud.com.my/,$$ - $$$,$$ - $$$IndianMiddle EasternPakistani,+60 13-525 9000,"Vegetarian Friendly, Vegan Options","Lunch, Dinner, Drinks"
Michelangelo’s Restaurant @ Solaris Mont’ Kiara,4.5 ,"Lot J-OG-03, Soho KL No. 2 Jalan Solaris Solaris Mont Kiara, Kuala Lumpur 50480 Malaysia",http://www.michelangelos-restaurants.com/m-res/,$$ - $$$,$$ - $$$ItalianSteakhousePizza,+60 3-6203 7734,"Italian, Pizza, European, Steakhouse, Seafood",Vegetarian Friendly
Bobo KL,4.5 ,"65-2 Jalan Bangkung Bangsar, Kuala Lumpur 59100 Malaysia",http://bobokl.com/,$$$$,$$$$BarEuropeanWine Bar,+60 3-2092 5002,"Dinner, Drinks","Reservations, Seating, Parking Available, Street Parking, Serves Alcohol, Full Bar, Wine and Beer, Accepts American Express, Accepts Mastercard, Accepts Visa, Free Wifi, Table Service, Accepts Credit Cards"
Gobo Chit Chat,4.0 ,"Traders Hotel Kuala Lumpur Kuala Lumpur City Centre, Kuala Lumpur Malaysia",http://www.shangri-la.com/kualalumpur/traders/dining/restaurants/gobo-chit-chat/,$$ - $$$,$$ - $$$SeafoodInternationalAsian,+60 3-2332 9888,"Vegetarian Friendly, Gluten Free Options","Breakfast, Lunch, Dinner, After-hours"
Coliseum Cafe,3.5 ,"98-100 & 102 Jalan Tuanku Abdul Rahman Little India, Kuala Lumpur 50100 Malaysia",http://www.coliseum1921.com/,$$ - $$$,$$ - $$$MalaysianHalal,+60 3-2692 6270,Malaysian,Halal
Portofino Bangsar Lucky Garden,4.0 ,"1 Persiaran Ara Lucky Garden, Kuala Lumpur 59100 Malaysia",http://www.facebook.com/Portofino-Bangsar-Lucky-Garden-392162064280187/,$$ - $$$,$$ - $$$ItalianPizzaMediterranean,+60 16-775 2387,"Italian, Pizza, Mediterranean, European",Vegetarian Friendly
Cafe Cafe,4.0 ,"175 Jalan Maharajalela Chinatown, Kuala Lumpur 50150 Malaysia",http://www.cafecafe.com.my/main.html,$$$$,$$$$FrenchEuropean,+60 3-2145 8141,"French, European",Dinner
Pavilions Lounge,4.5 ,"Sheraton Imperial Kuala Lumpur Jalan Sultan Ismail Jalan Sultan Ismail, Kuala Lumpur 50250 Malaysia",http://www.sheratonimperialkualalumpur.com/pavilionslounge,$$ - $$$,$$ - $$$BarCafePub,+60 3-2717 9900,"Breakfast, Lunch, Dinner","Reservations, Serves Alcohol, Seating, Table Service"
Little Penang Kafe,4.0 ,"1st Floor Mid Valley Megamall, Kuala Lumpur Malaysia",http://www.midvalley.com.my/tenant/LittlePenangKafe/14a9d6a2-ca14-4fc3-a4c3-b8ddb7ab2f0c/EAT,$$ - $$$,$$ - $$$AsianNonya/MalaysianMalaysian,+60 3-7732 9215,Halal,"Lunch, Dinner"
Luk Yu Tea House,4.0 ,"181 Jalan Bukit Bintang The Starhill, Kuala Lumpur 55100 Malaysia",http://www.thestarhilldining.com/outlets/luk-yu-tea-house/,$$ - $$$,$$ - $$$ChineseAsianCantonese,+60 18-632 8060,"Vegetarian Friendly, Halal","Lunch, Dinner"
The Daily Grind,4.0 ,"Lower Ground Floor, Bangsar Village, 1 Jalan Telawi 1, Kuala Lumpur 59100 Malaysia",http://thedailygrind.com.my/,$$ - $$$,$$ - $$$AmericanBarVegetarian Friendly,+60 3-4265 7600,"American, Bar",Vegetarian Friendly
Tarma Iraqi Street Food,4.5 ,"83 Jalan Berangan Bukit Bintang, Kuala Lumpur 50200 Malaysia",,$$ - $$$,$$ - $$$Middle EasternArabicVegetarian Friendly,+60 3-2110 4747,"Vegetarian Friendly, Vegan Options, Halal","Lunch, Dinner"
Ichi Zen Japanese Restaurant,4.0 ,"168, Bukit Bintang Street 6.24.1B, Level 6, Kuala Lumpur 55100 Malaysia",http://www.pavilion-kl.com/viewstore/Ichi-Zen,$$ - $$$,$$ - $$$JapaneseCentral AsianVegetarian Friendly,+60 3-2142 8333,Vegetarian Friendly,"Lunch, Dinner"
Breakfast Thieves,4.0 ,"29-5 Jalan Riong Bangsar, Kuala Lumpur 59100 Malaysia",http://www.breakfastthieves.com/,$$ - $$$,$$ - $$$MalaysianVegetarian FriendlyVegan Options,+60 3-2788 3548,Malaysian,"Vegetarian Friendly, Vegan Options, Gluten Free Options"
Wildflowers,4.5 ,"50000 Kuala Lumpur, Malaysia. No. 153 Jalan Petaling, Kuala Lumpur 50000 Malaysia",http://letsumai.com/widget/wildflowers,$$ - $$$,$$ - $$$Asian,+60 3-2856 3369,,
Annie 1 Family Restaurant,4.0 ,"20 Jalan Ss 21/58 Damansara Utama, Petaling Jaya 47400 Malaysia",,$,$ChineseAsianMalaysian,+60 12-336 9328,"Breakfast, Lunch, Dinner, Brunch","Takeout, Seating"
Entier French Dining,4.0 ,"No 58 Jalan Ang Seng Level 41, Alila Bangsar, Kuala Lumpur 50470 Malaysia",http://entierfrenchdining.com/,$$$$,$$$$FrenchEuropean,+60 16-263 0596,"French, European","Lunch, Dinner, Drinks"
Quan's Kitchen,4.5 ,"No 2 Jalan Balai Polis Level 8, Four Points by Sheraton, Kuala Lumpur 50000 Malaysia",https://marriottbonvoyasia.com/restaurants-bars/four-points-kuala-lumpur-chinatown-quans-kitchen,$$ - $$$,$$ - $$$InternationalAsianFusion,+60 3 2035 7333,"Asian, International, Fusion, Diner, Malaysian",Vegetarian Friendly
Bistro a Table,4.0 ,"6 Jalan 17/54 Seksyen 17, Petaling Jaya 46400 Malaysia",http://www.bistroatable.com/,$$$$,$$$$FrenchInternationalEuropean,+60 3-7931 2831,"French, International, European, Contemporary, Caucasian",Vegetarian Friendly
Q Cup cafe,4.5 ,"72, Jalan Imbi, Kuala Lumpur 55100 Malaysia",http://www.facebook.com/qcupcafe,$$ - $$$,$$ - $$$CafeWine BarVegetarian Friendly,+60 3-2113 0320,"Cafe, Wine Bar",Vegetarian Friendly
Chateau Dionne,4.5 ,"24, Jalan Medan Setia 2 Damansara heights, Kuala Lumpur 50490 Malaysia",http://chateaudionne.com/,$$$$,$$$$FrenchEuropeanVegetarian Friendly,+60 11-5110 7309,Vegetarian Friendly,"Lunch, Dinner, Brunch"
Sushi Zanmai,4.0 ,"T-217, Third Floor, The Gardens, Mid Valley City, Lingkaran Syed Putra The Gardens Mall, Kuala Lumpur 59200 Malaysia",http://www.supersushi.com.my/,$$ - $$$,$$ - $$$JapaneseSushiAsian,+60 12-702 1160,Vegetarian Friendly,"Lunch, Dinner, Brunch, After-hours"
Croisserie Artisan Bakery,4.5 ,"14 Jalan Medan Setia 2 Bukit Damansara, Kuala Lumpur 50490 Malaysia",http://croisserie.com.my/,$$ - $$$,$$ - $$$BakeriesCafe,+60 12-564 4154,"Breakfast, Lunch, Brunch, Drinks","Takeout, Delivery, Outdoor Seating, Seating, Street Parking, Free Wifi, Accepts Credit Cards, Non-smoking restaurants"
Delhi Royale,4.0 ,"Lot No. 3, 33, Wisma Longrich, Jalan Yap Kwen Seng, Kuala Lumpur 50450 Malaysia",http://www.delhiroyale.com/,$$$$,$$$$IndianVegetarian FriendlyVegan Options,+60 127740155,Indian,"Vegetarian Friendly, Vegan Options, Halal, Gluten Free Options"
Wurst,5.0 ,"15-G, Persiaran Ara Kiri Bangsar, Kuala Lumpur 59100 Malaysia",https://www.wurstkl.com/,$$ - $$$,$$ - $$$GermanDeli,+60 124234588,"Deli, German","Lunch, Dinner, Brunch, After-hours, Drinks"
Damascus Restoran,4.5 ,"Jalan Sultan Ismail, Bukit Bintang Sungei Wang Plaza, Kuala Lumpur 55100 Malaysia",http://damascusmy.business.site/,$,$LebaneseFast foodMediterranean,+60 17-316 4981,"Lebanese, Fast food, Mediterranean, Middle Eastern, Arabic","Vegetarian Friendly, Halal"
Dave's Bistro Bar & Grill,4.0 ,"Lot G209 The Promenade One Utama Shopping Centre, Petaling Jaya 47800 Malaysia",http://davesbistro.com/,$$ - $$$,$$ - $$$EuropeanVegetarian Friendly,+60 3-7725 4017,European,Vegetarian Friendly
Arabella Restaurant,4.5 ,"Jalan Nagasari Opposite Parkroyal Service Appartments, Kuala Lumpur 50250 Malaysia",http://arabellabb.com/,$$$$,$$$$AsianMiddle EasternMalaysian,+60 13-375 0750,"Asian, Middle Eastern, Malaysian, Arabic","Halal, Vegetarian Friendly"
FLOUR,4.0 ,"12, Jalan Kamuning Off Jalan Imbi, Kuala Lumpur 55100 Malaysia",https://www.facebook.com/FLOURRESTAURANT,$$ - $$$,$$ - $$$IndianAsianVegetarian Friendly,+60 12-960 0053,"Vegetarian Friendly, Vegan Options, Halal, Gluten Free Options","Lunch, Dinner"
Fat Tea Macanese Food,4.5 ,"Jalan PJU 8/3a Unit LG-05, Plaza Emerald North, Jalan PJU 8/3A, Damansara Perdana, Petaling Jaya 47820 Malaysia",http://www.facebook.com/Fat-Tea-Macanese-Food-366189550379907/,$$ - $$$,$$ - $$$CafeAsian,+60 3-7733 1868,"Lunch, Dinner, Brunch, Drinks","Seating, Takeout, Street Parking, Digital Payments, Free Wifi, Table Service, Reservations, Serves Alcohol"
Ti Chen Chinese Restaurant,4.5 ,"Jalan Lapangan Terbang SAAS Saujana Resort, Shah Alam 40150 Malaysia",http://www.saujanahotels.com/dining/ti-chen,$$$$,$$$$ChineseAsianVegetarian Friendly,+60 3-7843 1234,"Vegetarian Friendly, Vegan Options","Lunch, Dinner"
Pampas at Old Malaya,4.0 ,"Bukit Bintang 66-68 Jalan Raja Chulan, Kuala Lumpur 50200 Malaysia",http://www.pampas.com.my/,$$ - $$$,$$ - $$$Steakhouse,+60 3-2079 5548,"Dinner, Drinks","Reservations, Outdoor Seating, Seating, Wheelchair Accessible, Serves Alcohol, Full Bar, Table Service, Valet Parking, Highchairs Available"
Le Shady Trinity Cafe,5.0 ,"Petaling Street Ground Floor 177,Jalan Tun H. S. Lee, Kuala Lumpur 50000 Malaysia",http://le-shady-trinity-cafe.business.site/?utm_source=gmb&utm_medium=referral,$,$CafeAsianVegetarian Friendly,+(60)3320220882,"Cafe, Asian","Vegetarian Friendly, Vegan Options"
Miss Ellie Tea House,4.5 ,"No.7 Jalan H 3, Taman Melawati, Kuala Lumpur 53100 Malaysia",http://www.facebook.com/missellieteahouse,$$ - $$$,$$ - $$$CafeBritishVegetarian Friendly,+60 3-4162 0113,Vegetarian Friendly,"Lunch, Dinner"
Chocha Foodstore,4.0 ,"156 Jalan Petaling, Kuala Lumpur 50000 Malaysia",http://www.facebook.com/chocha.foodstore/,$$ - $$$,$$ - $$$MalaysianVegetarian FriendlyVegan Options,+60 3-2022 1100,Malaysian,"Vegetarian Friendly, Vegan Options"
Salad Atelier the Weld,4.5 ,"Lot G-09A Ground Floor, The Weld 76 Jalan Raja Chulan, Kuala Lumpur 50200 Malaysia",http://www.saladatelier.com/,$$ - $$$,$$ - $$$Quick BitesFusionHealthy,+60 11-1258 8992,"Fusion, Healthy","Vegetarian Friendly, Vegan Options, Gluten Free Options, Halal"
Wong Kee Hai Lam Chicken Rice & Roast Pork,4.5 ,"30 Jalan Nyonya Off Jalan Pudu, Kuala Lumpur 55100 Malaysia",http://www.facebook.com/Lescapade-Telgruc-107957154279283/,$$ - $$$,$$ - $$$ChineseAsianMalaysian,+60 3-2145 2512,Lunch,"Takeout, Outdoor Seating, Seating"
Upstairs Cafe,4.0 ,"1st Flr 12A Ss 12/18, Subang Jaya 47610 Malaysia",http://www.facebook.com/profile.php?id=225364964149163,$$ - $$$,$$ - $$$DessertCafeHalal,+60 5-611 9171,Halal,"Breakfast, Lunch, Dinner, Brunch"
Ginger Restaurant,4.0 ,"Jalan Hang Kasturi Central Market Annexe, Kuala Lumpur 50050 Malaysia",http://www.facebook.com/pages/category/Thai-Restaurant/Ginger-Thai-Cuisine-554120355095137/,$$ - $$$,$$ - $$$AsianThaiVegetarian Friendly,+60 3-2273 7371,"Vegetarian Friendly, Vegan Options","Lunch, Dinner"
Hawker Stalls in Chinatown,4.0 ,"Jln Sultan & Jln Tun HS Lee Chinatown, Kuala Lumpur Malaysia",,$,$ChineseAsian,,"Lunch, Dinner, Brunch, After-hours",Takeout
Wellness Recipe,4.5 ,"10 Boulevard A-1-5, Block Allamanda, Lebuhraya Sprint PJU 6A, Petaling Jaya 47400 Malaysia",http://www.wellnessconcept.net/,$$ - $$$,$$ - $$$AsianHealthyMalaysian,+60 3-7727 9999,"Healthy, Malaysian, Asian","Vegetarian Friendly, Vegan Options, Halal"
Eyuzu Japanese Cuisine,4.5 ,"13, Jalan 16/11, Pusat Dagang Seksyen 16 Eastin Hotel, Petaling Jaya 46350 Malaysia",https://www.facebook.com/Eyuzu-Japanese-Cuisine-1074750895995830/,$$ - $$$,$$ - $$$JapaneseSushiAsian,+60 3-7665 1111,"Lunch, Dinner","Reservations, Seating, Parking Available, Valet Parking, Private Dining, Validated Parking, Highchairs Available, Table Service"
ICC Pudu,4.0 ,"Jalan 1/77c ICC Pudu, Kuala Lumpur 55100 Malaysia",http://www.estacaolanche.com.br/,$,$ChineseAsianMalaysian,+60 3-2111 1111,"Breakfast, Lunch","Takeout, Wheelchair Accessible"
Fresh Unique Seafood 23,4.0 ,"9b-3 Jalan Jalan Kemajuan Jln kemajuan section 13,, Petaling Jaya 46200 Malaysia",http://unique-seafood.com.my/ContactUs,$$ - $$$,$$ - $$$ChineseSeafoodAsian,+60 3-7960 2088,"Lunch, Dinner, Brunch","Reservations, Private Dining, Seating, Parking Available, Validated Parking, Valet Parking, Highchairs Available, Wheelchair Accessible, Serves Alcohol, Wine and Beer, Table Service, Free Wifi"
SOULed OUT Kuala Lumpur,4.0 ,"No. 20 Jalan 30/70a Desa Sri Hartamas, Kuala Lumpur 50480 Malaysia",http://sokl.souledout.com.my/,$$ - $$$,$$ - $$$PizzaSeafoodMediterranean,+60 12-200 1955,"Pizza, Seafood, Mediterranean, Contemporary, Beer restaurants",Vegetarian Friendly
Anne Elizabeth The Deli Restaurant,4.0 ,"No 1 Jalan Manis 4 Taman Segar Cheras, Kuala Lumpur 56100 Malaysia",https://www.facebook.com/AnneElizabethTheDeliRestaurant,$$ - $$$,$$ - $$$SouthwesternEuropean,+60 3-9130 0319,"Southwestern, European","Lunch, Dinner"
Restoran Siu Siu,4.0 ,"Lorong Syed, Kuala Lumpur 50460 Malaysia",http://food.malaysiamostwanted.com/venues/restaurant-siu-siu-robson-height,$$ - $$$,$$ - $$$ChineseSeafoodAsian,+60 16-370 8555,Vegetarian Friendly,"Lunch, Dinner"
The Uma Bali,4.5 ,"Jalan PJU 5/21 The Strand, Kota Damansara, Petaling Jaya 47810 Malaysia",http://www.theumabali.com/,$$ - $$$,$$ - $$$AsianIndonesian,+60 3-6142 2771,"Asian, Indonesian","Lunch, Dinner"
Fuel Shack Signature,4.0 ,"No. 7 Jalan Bintang Lot G-28, Plaza Low Yat, Bukit Bintang Central, Kuala Lumpur 55100 Malaysia",http://www.fuelshack.com.my/,$$ - $$$,$$ - $$$AmericanPizzaFast food,+60 3-2110 5400,"Pizza, Fast food, American","Lunch, Dinner, Brunch"
Rise & Shine by Tapestry,4.5 ,"No. 28, Jalan Kamunting Chow Kit, Kuala Lumpur 50300 Malaysia",http://www.tapestrydining.my/,$$ - $$$,$$ - $$$GrillVegetarian FriendlyVegan Options,+60 3-7622 8720,Grill,"Vegan Options, Vegetarian Friendly"
Vantador,4.0 ,"38 Jalan 25/70a Desa Sri Hartamas, Kuala Lumpur 50480 Malaysia",https://www.vantador.co/,$$$$,$$$$SteakhouseArgentinian,+60 3-6211 5588,Dinner,"Reservations, Private Dining, Seating, Serves Alcohol, Table Service"
The Courtyard at Pavilion Hotel Kuala Lumpur,4.5 ,"Level 8, Pavilion Hotel Kuala Lumpur 170, Jalan Bukit Bintang, Kuala Lumpur 55100 Malaysia",http://www.banyantree.com/en/malaysia/pavilion-hotel/dining/the-courtyard,$$ - $$$,$$ - $$$InternationalAsianMalaysian,+60 3-2117 2821,"International, Asian, Malaysian",Vegetarian Friendly
Water Lily Vegetarian Restaurant,4.5 ,"23 Jalan Tun H S Lee, Kuala Lumpur 50000 Malaysia",http://www.facebook.com/osteriaalponte25/,$,$ChineseAsianVegetarian Friendly,+60 3-2070 6561,"Vegetarian Friendly, Vegan Options","Dinner, Lunch"
Nasi Lemak Wanjo,4.0 ,"8 Jalan Raja Muda Musa Kampung Baru, Kuala Lumpur 50300 Malaysia",,$,$AsianMalaysianHalal,+60 19-211 6453,,
PJ’s Bar & Grill,4.5 ,"Paradigm, 1 Jalan SS7/26A New World Hotels & Resorts, Petaling Jaya 47301 Malaysia",https://petalingjaya.newworldhotels.com/en/dining/pjs_barandgrill/,$$ - $$$,$$ - $$$BarGrillPub,+60 3-7682 0000,Vegetarian Friendly,"Dinner, Lunch, After-hours, Drinks"
SOULed OUT Ampang,4.0 ,"No 360 Jalan Tun Razak G-12-AF, Ground Floor, The Linc, Kuala Lumpur 50400 Malaysia",http://soa.souledout.com.my/,$$ - $$$,$$ - $$$BarInternationalAsian,+60 12-655 7622,"Bar, Asian, International","Vegetarian Friendly, Vegan Options"
Bubble Bee Cafe,4.5 ,"139, Jalan Petaling, Kuala Lumpur 50000 Malaysia",https://www.facebook.com/bubblebeemy/,$,$DessertCafeFusion,+60 16-228 9881,"Cafe, Fusion, Street Food","Vegetarian Friendly, Vegan Options"
The Ice Cream Bar,4.5 ,"60, Jalan 27/70a, Desa Sri Hartamas, Kuala Lumpur 50480 Malaysia",,$$ - $$$,$$ - $$$DessertCafe,+60 3-2856 7435,"Seating, Takeout",
1919 Restaurant,4.0 ,"15A Jalan Yap Kwan Seng, Kuala Lumpur 50450 Malaysia",https://www.facebook.com/1919-Restaurant-KL-334264829917989/,$$ - $$$,$$ - $$$AsianVegetarian FriendlyVegan Options,+60 3-2161 9919,"Vegan Options, Vegetarian Friendly","Dinner, Lunch"
Jao Tim,4.5 ,"First Floor No. 61 Jalan Sultan, Kuala Lumpur 50000 Malaysia",https://www.facebook.com/JaoTimKL/,$$ - $$$,$$ - $$$FrenchBarCafe,+60 3-2022 3897,"Breakfast, Brunch, Lunch, Dinner, Drinks","Seating, Delivery, Takeout, Buffet, Street Parking, Free off-street parking, Serves Alcohol, Digital Payments, Free Wifi, Accepts Credit Cards, Table Service"
Coffea Coffee,4.0 ,"No. 8 Jalan Telawi 2 Bangsar, Kuala Lumpur 59100 Malaysia",http://www.coffea.my/,$$ - $$$,$$ - $$$Quick BitesCafeHalal,+60 3-2201 3338,Halal,"Breakfast, Brunch"
Senya Izakaya Publika,4.0 ,"1 Jalan Dutamas D5-G3-1, Solaris Dutamas, Kuala Lumpur 50480 Malaysia",,$$ - $$$,$$ - $$$JapaneseSushiAsian,+60 3-6205 4999,"Japanese, Sushi, Asian","Lunch, Dinner"
Restoran Kudu Bin Abdul Nasi Kandar Penang,4.0 ,"Jalan Tunku Abdul Rahman (opposite Tune Hotel Downtown KL), Kuala Lumpur Malaysia",http://www.mn-marahja-93.fr/,$,$AsianMalaysian,+60 12-213 7082,"Lunch, Brunch","Takeout, Wheelchair Accessible, Seating"
Nando's,3.5 ,"Lot C07 Concourse Floor, Suria KLCC, Kuala Lumpur City Centre, Kuala Lumpur 50088 Malaysia",http://www.nandos.com.my/,$$ - $$$,$$ - $$$Halal,+60 3-2166 6555,Halal,"Lunch, Dinner, After-hours"
Yarl Restaurant,4.5 ,"50 Jalan Padang Belia Brickfields, Kuala Lumpur 50470 Malaysia",https://www.facebook.com/YarlRestaurant/,$$ - $$$,$$ - $$$AsianMalaysianSri Lankan,+60 10-360 6624,"Vegetarian Friendly, Vegan Options","Breakfast, Dinner, Brunch, Lunch"
Old Town White Coffee,3.5 ,"Jalan Tun Sambanthan 4, Kuala Lumpur 50470 Malaysia",,$$ - $$$,$$ - $$$CafeAsianMalaysian,,"Breakfast, Lunch, Dinner, Brunch, After-hours","Takeout, Seating, Wheelchair Accessible, Free Wifi, Table Service"
Chez Gaston,4.5 ,"12 Jalan bangsar utama 9, Kuala Lumpur 59000 Malaysia",http://www.facebook.com/chezgastonkl,$$ - $$$,$$ - $$$FrenchEuropean,+60 11-3993 0036,"French, European","Lunch, Dinner"
Senja Restaurant,4.0 ,"Jalan Lapangan Terbang SAAS Saujana Resort, Shah Alam 40150 Malaysia",http://www.saujanahotels.com/,$$$$,$$$$ItalianEuropeanVegetarian Friendly,+60 3-7843 1234,"Vegetarian Friendly, Vegan Options","Lunch, Dinner"
Soleil,4.0 ,"6 Jalan Damanlela Lot 13A & 15, 2nd Floor, Damansara City Mall, Damansara Heights, Kuala Lumpur 50490 Malaysia",http://www.soleil.my/,$$$$,$$$$FrenchInternationalEuropean,+60 3-2011 8261,"International, European, French","Vegetarian Friendly, Vegan Options, Gluten Free Options"
Table 23,4.0 ,"23 Jalan Mesui, Kuala Lumpur 50200 Malaysia",http://www.table23.com.my/,$$ - $$$,$$ - $$$BarAsianPub,+60 3-2141 0023,"Bar, Asian, Pub, Fusion","Lunch, Dinner, After-hours, Drinks"
Nasi Ayam Hainan Chee Meng,4.0 ,"50 Jalan Bukit Bintang, Kuala Lumpur 55100 Malaysia",http://www.cheemeng.com.my/,$$ - $$$,$$ - $$$ChineseAsianMalaysian,+60 3-2110 5663,"Chinese, Asian, Malaysian",Halal
Isetan The Japan Store Lot 10,4.0 ,"50 Jalan Sultan Ismail, Kuala Lumpur 50250 Malaysia",http://www.isetankl.com.my/thejapanstore/,$$ - $$$,$$ - $$$JapaneseAsianVegetarian Friendly,+60 3-2141 7777,Vegetarian Friendly,"Lunch, Dinner, Brunch, Drinks"
Ichiro Sushi Bar,4.5 ,"101 F Lb First Floor, Isetan One Utama Shopping Centre, Petaling Jaya 47800 Malaysia",http://www.facebook.com/Pikeos/,$$ - $$$,$$ - $$$JapaneseSeafoodSushi,+60 3-7726 5899,"Lunch, Dinner, Brunch","Serves Alcohol, Seating, Table Service"
OneSixFive Lounge,4.5 ,"165 Jalan Ampang InterContinental Kuala Lumpur, an IHG Hotel, Kuala Lumpur 50450 Malaysia",https://kualalumpur.intercontinental.com/dining/onesixfive,$$ - $$$,$$ - $$$International,+60 3-2782 6173,"Lunch, Dinner, Drinks, Breakfast","Takeout, Reservations, Seating, Parking Available, Wheelchair Accessible, Serves Alcohol, Full Bar, Accepts American Express, Accepts Mastercard, Accepts Visa, Free Wifi, Table Service, Accepts Credit Cards"
MAiSEN Sunway Pyramid,4.5 ,"3, Jalan PJS 11/15, Bandar Sunway, Sunway Pyramid LG1.45, Lower Ground One, Sunway Pyramid Mall, Petaling Jaya 47500 Malaysia",http://www.maisen.com.my/,$$ - $$$,$$ - $$$Japanese,+60 12-347 2473,"Breakfast, Lunch, Dinner, Brunch, Drinks","Parking Available, Validated Parking, Valet Parking, Highchairs Available, Serves Alcohol, Accepts Mastercard, Accepts Visa, Digital Payments, Free Wifi, Accepts Credit Cards"
Koon Kee Wan Tan Mee,4.0 ,"95, Jalan Hang Lekir, Kuala Lumpur 50000 Malaysia",http://www.facebook.com/KoonKeeDaTong/,$,$ChineseMalaysian,+60 3-2078 6554,"Lunch, Brunch, Dinner","Takeout, Seating"
Grand Imperial Restaurant @ Bangsar Shopping Centre,4.0 ,"Lot T5 No. 285 Jalan Maarof 3rd Floor, Bangsar Shopping Centre, Kuala Lumpur 59000 Malaysia",http://www.grandimperial.com.my/outlets/grand-imperial-restaurant-bangsar-shopping-centre/,$$$$,$$$$ChineseAsianCantonese,+60 3-2283 1118,"Lunch, Dinner","Reservations, Private Dining, Seating, Parking Available, Wheelchair Accessible, Serves Alcohol, Table Service, Takeout, Highchairs Available"
Pan & Tamper,4.5 ,"No. 1 Jalan Dutamas 1 Block D1 Level G3-9, Publika , Solaris Dutamas, Kuala Lumpur 50480 Malaysia",http://www.facebook.com/panandtamper/,$$ - $$$,$$ - $$$CafeSpanishAsian,+60 3-6206 2929,"Spanish, Asian, Australian, Cafe, Malaysian","Vegetarian Friendly, Vegan Options"
Flight Club Grab 'n' Go,5.0 ,"Level 2M, Gateway@klia2, Terminal Klia2 Kuala Lumpur International Airport, Kuala Lumpur 64000 Malaysia",https://www.airport-dining.com/flight-club,$$ - $$$,$$ - $$$Quick BitesDeli,+60 3-8778 0810,"Lunch, Dinner","Seating, Table Service"
"Dolly Dim Sum, Pavilion Elite",4.0 ,"168 Jalan Bukit Bintang Lot 1. 102. 00, Level 1 Pavilion Kuala Lumpur, Kuala Lumpur 55100 Malaysia",http://www.dollydimsum.com/,$$ - $$$,$$ - $$$ChineseAsianCantonese,+60 3-2110 5019,"Chinese, Asian","Vegetarian Friendly, Halal"
Warisan Cafe,4.0 ,"5 Jalan Conlay Royale Chulan Kuala Lumpur, Kuala Lumpur 50450 Malaysia",http://www.theroyalechulan.com/dining/,$$ - $$$,$$ - $$$AsianMalaysianVegetarian Friendly,+60 3-2688 9611,"Asian, Malaysian","Vegetarian Friendly, Vegan Options, Halal, Gluten Free Options"
OZEKI Tokyo Cuisine,4.0 ,"Menara TA One Ground Floor No. 22 Jalan P Ramlee 22, Jalan P. Ramlee, Kuala Lumpur 50250 Malaysia",http://www.ozeki.com.my/,$$ - $$$,$$ - $$$JapaneseSeafoodSushi,+60 3-2166 4263,,
Blue Boy Vegetarian Food Centre,4.0 ,"Jln Tong Shin Golden Triangle, Kuala Lumpur 50200 Malaysia",,$,$AsianMalaysianVegetarian Friendly,+60 16-685 0498,"Vegetarian Friendly, Vegan Options","Lunch, Breakfast"
