Name,Rating,Address,URL,Price,Type,Phone,Cousine,Meals
Blitz X Colony @ KLCC,5.0 ,"6 Jalan Kia Peng Colony Coworking Space - KLCC, Kuala Lumpur 50450 Malaysia",,$$ - $$$,$$ - $$$FrenchJapaneseCafe,+60 16-842 6778,"French, Japanese, Cafe, International, Malaysian","Breakfast, Lunch, Brunch, Drinks"
Paya Serai,4.5 ,"No 2 Jalan barat Hilton Petaling Jaya, Petaling Jaya 46200 Malaysia",http://eatdrinkhilton.com/paya-serai/#/,$$ - $$$,$$ - $$$InternationalAsianMalaysian,+60 3-7955 3533,"International, Asian, Malaysian","Vegetarian Friendly, Vegan Options, Halal, Gluten Free Options"
The Lounge,5.0 ,"Jalan Stesen Sentral, Kuala Lumpur 50470 Malaysia",http://eatdrinkhilton.com/the-lounge-hiltonkl/#/,$$ - $$$,$$ - $$$InternationalAsianMalaysian,+60 3-2264 2264,"International, Asian, Malaysian","Lunch, Dinner, Breakfast, Drinks"
Nero Nero,4.5 ,"L3-02 Jalan Damanlela Damansara, Kuala Lumpur 50490 Malaysia",http://www.neronero-dc3.com/,$$ - $$$,$$ - $$$ItalianEuropeanVegetarian Friendly,+60 19-667 4546,"Italian, European","Vegetarian Friendly, Vegan Options, Gluten Free Options"
Bottega Lounge,5.0 ,"Equatorial Plaza, Jalan Sultan Ismail Ground Floor, Kuala Lumpur 50250 Malaysia",http://www.eqkualalumpur.equatorial.com/dining/bottega/,$$ - $$$,$$ - $$$BarWine Bar,+60 3-2789 7777,"Bar, Wine Bar","Lunch, Dinner, Drinks"
The Whisky Bar,4.5 ,"46 Changkat Bukit Bintang Bukit Bintang, Kuala Lumpur 50200 Malaysia",http://www.thewhiskybarkl.com/,$$ - $$$,$$ - $$$BarEuropeanVegetarian Friendly,+60 12-735 6709,"Vegetarian Friendly, Gluten Free Options","Dinner, Drinks"
The Grand Getaway by Grand Hyatt Kuala Lumpur,5.0 ,"12, Jalan Pinang, Kuala Lumpur 50450 Malaysia",http://thegrandgetaway.com.my/,$$$$,$$$$Vegetarian FriendlyGluten Free Options,+60 3-2182 1234,"Vegetarian Friendly, Gluten Free Options","Lunch, Dinner, Drinks"
The Dark Horse - Bar & Grill,5.0 ,"Lot G-05, Ground Floor, Life Centre 20 Jalan Sultan Ismail, Kuala Lumpur 50250 Malaysia",http://www.darkhorse.my/,$$ - $$$,$$ - $$$SteakhouseBarEuropean,+60 19-333 9269,,
Beta KL,5.0 ,"No. 10 Jalan Perak Ground Floor, Cormar Suites, Kuala Lumpur 50450 Malaysia",http://www.betakl.com/,$$$$,$$$$AsianMalaysianVegetarian Friendly,+60 19-212 1094,,
Beta KL,,,,,,,,
Skillet KL,4.5 ,"No. 10 Jalan Perak Ground Floor, Cormar Suites, Kuala Lumpur 50450 Malaysia",http://www.skilletkl.com/,$$$$,$$$$EuropeanAsianVegetarian Friendly,+60 19-212 1240,"European, Asian","Vegetarian Friendly, Vegan Options, Halal, Gluten Free Options"
"YEN, W Kuala Lumpur",5.0 ,"121 Jalan Ampang Level 11, W Kuala Lumpur, Kuala Lumpur 50450 Malaysia",https://www.marriott.com/en-us/hotels/kulwh-w-kuala-lumpur/dining/,$$$$,$$$$ChineseAsianCantonese,+60 12-347 9088,"Chinese, Asian","Vegetarian Friendly, Vegan Options, Gluten Free Options"
"YEN, W Kuala Lumpur",,,,,,,"Chinese, Asian","Vegetarian Friendly, Vegan Options, Gluten Free Options"
Nadodi KL,5.0 ,"1st Floor, Lot 183 Jalan Yap Kwan Seng, Kuala Lumpur 50450 Malaysia",http://www.nadodikl.com/,$$$$,$$$$IndianAsianVegetarian Friendly,+60 17-296 9520,"Indian, Asian","Vegetarian Friendly, Vegan Options, Halal, Gluten Free Options"
Nadodi KL,,,,,,,,
The Lounge at Four Seasons,4.5 ,"145 Jalan Ampang Four Seasons Hotel Kuala Lumpur, Kuala Lumpur 50450 Malaysia",http://www.fourseasons.com/kualalumpur/dining/lounges/lobby-lounge/,$$$$,$$$$International,+60 3-2382 8650,"Breakfast, Lunch, Dinner, Drinks","Takeout, Reservations, Seating, Parking Available, Validated Parking, Valet Parking, Highchairs Available, Serves Alcohol, Free Wifi, Accepts Credit Cards, Table Service, Wine and Beer, Non-smoking restaurants"
Rooftop 25 Bar and Lounge KL,4.5 ,"452 Jalan Tuanku Abdul Rahman Level 25 of Hilton Garden Inn KL South, Kuala Lumpur 50100 Malaysia",http://www.eatdrinkhilton.com/rooftop-25-bar-lounge/,$$ - $$$,$$ - $$$AsianMalaysianDining bars,+60 3-2771 6888,"Asian, Malaysian, Dining bars",Vegetarian Friendly
Healy Mac's,4.5 ,"No. 38 Changkat Bukit Bintang, Kuala Lumpur 50200 Malaysia",http://www.healymacs.com/index.php,$$ - $$$,$$ - $$$IrishBarEuropean,+60 3-2145 1778,"Vegetarian Friendly, Vegan Options, Gluten Free Options","Breakfast, Lunch, Dinner, Brunch"
Horizon Grill,4.5 ,"2 Jalan Conlay Banyan Tree Hotel & reseidence, Kuala Lumpur 50450 Malaysia",http://www.banyantree.com/en/malaysia/kuala-lumpur/dining/horizon-grill,$$$$,$$$$InternationalEuropeanGrill,+60 3-2113 1821,"European, International, Grill",Gluten Free Options
Tokyo Secret,4.5 ,"1 Lingkaran Syed Putra Lot F001, First Floor Midvalley Megamall, Mid Valley City, Kuala Lumpur 58000 Malaysia",,$$ - $$$,$$ - $$$BakeriesCafeEuropean,+60 3-2201 3342,"Seating, Accepts Credit Cards, Table Service",
Mandarin Grill,4.5 ,"Kuala Lumpur City Centre, Kuala Lumpur 50088 Malaysia",https://www.mandarinoriental.com/en/kuala-lumpur/petronas-towers/dine/mandarin-grill?src=loc.local_listing.mokul.yxt,$$$$,$$$$ItalianSteakhouseGrill,+60 3-2380-8888,,
OGA Tea & Dining,4.5 ,"18, Jalan Kamuning Off Jalan Imbi, Kuala Lumpur 55100 Malaysia",https://linktr.ee/oga.my,$$$$,$$$$JapaneseCafeHealthy,+60 12-238 2285,"Japanese, Japanese Fusion, Cafe, Healthy, Kyoto cuisine","Breakfast, Lunch, Dinner, Brunch, After-hours"
Makan Kitchen,4.5 ,"The Intermark, 348 Jalan Tun Razak, The Intermark, 348 Jalan Tun Razak,, Kuala Lumpur 50400 Malaysia",,$$ - $$$,$$ - $$$ChineseHealthyMalaysian,+60 3-2172 7272,"Chinese, Healthy, Malaysian","Vegetarian Friendly, Vegan Options, Halal, Gluten Free Options"
The Living Room,4.5 ,"199 Jalan Bukit Bintang The Westin Hotel, Kuala Lumpur 55100 Malaysia",http://www.thewestinkualalumpur.com/thelivingroom,$$ - $$$,$$ - $$$InternationalAsianMalaysian,+60 3-2773 8495,"Vegetarian Friendly, Vegan Options, Halal, Gluten Free Options","Breakfast, Lunch, Dinner, Brunch, Drinks"
Zenzero Restaurant & Wine Bar,4.5 ,"A-0-9, Ground Floor, St Mary Place, No. 1, Jalan Tengah Off Jalan P. Ramlee, Kuala Lumpur 50450 Malaysia",http://www.zenzerogroup.com/,$$$$,$$$$ItalianEuropeanVegetarian Friendly,+60 3-2022 2899,"Vegetarian Friendly, Vegan Options, Gluten Free Options","Lunch, Dinner, Brunch"
Le Petit Chef - Kuala Lumpur,4.5 ,"12 Jalan Pinang Grand Hyatt Kuala Lumpur, Kuala Lumpur 50450 Malaysia",http://www.lepetitchef.com/kuala-lumpur,$$$$,$$$$FrenchChineseIndian,+60 3-2182 1234,,
Iki Omakase,5.0 ,"16, Jalan Kamuning, Off Jalan Imbi, Kuala Lumpur 55100 Malaysia",http://ikiomakase.com/,$$$$,$$$$JapaneseSeafoodJapanese Fusion,+60 12-885 5184,"Lunch, Dinner, Brunch, Drinks","Reservations, Seating, Serves Alcohol, Table Service, Private Dining, Parking Available, Valet Parking, Free off-street parking, Wheelchair Accessible, Wine and Beer, Accepts American Express, Accepts Mastercard, Accepts Visa, Free Wifi, Accepts Credit Cards"
Manja,4.5 ,"No. 6 Lorong Raja Chulan, Kuala Lumpur 50250 Malaysia",http://manja.com.my/,$$ - $$$,$$ - $$$ContemporaryCentral AsianVegetarian Friendly,+60 12-373 7063,,
Blitz X Colony @ KLCC,5.0 ,"6 Jalan Kia Peng Colony Coworking Space - KLCC, Kuala Lumpur 50450 Malaysia",http://blitzandco.com/,$$ - $$$,$$ - $$$FrenchJapaneseCafe,+60 16-842 6778,"French, Japanese, Cafe, International, Malaysian","Breakfast, Lunch, Brunch, Drinks"
Burger on 16,4.5 ,"16 Jalan 1/77a Imbi, Kuala Lumpur 55100 Malaysia",http://www.facebook.com/BURGERon16/,$,$Quick BitesAmericanFast food,+60 3-9224 2117,"American, Australian, Fast food","Vegetarian Friendly, Vegan Options, Halal"
Pier 12 Seafood Tavern,4.5 ,"Old Malaya Lot 12 No. 66-68 Jalan Raja Chulan Old Malaya, Kuala Lumpur 50200 Malaysia",,$$ - $$$,$$ - $$$SeafoodInternationalGrill,+60 17-245 4685,,
Old Shanghai,4.5 ,"50 Changkat Bukit Bintang, Kuala Lumpur 50200 Malaysia",https://oldshanghaikl.com/,$$ - $$$,$$ - $$$ChineseBarAsian,+60 12-526 1335,"Vegetarian Friendly, Vegan Options, Gluten Free Options","Lunch, Dinner, Brunch, Drinks"
Healy Mac's,4.5 ,"Jalan P Ramlee Crown Regency, No.12 Ground Floor, Kuala Lumpur 50250 Malaysia",,$$ - $$$,$$ - $$$IrishBarInternational,+60 3-2166 9778,"Irish, Bar, European, Pub, International","Vegetarian Friendly, Vegan Options, Gluten Free Options"
Healy Mac's Irish Bar and Restaurant,4.5 ,"A4-G2-06-07 Solaris Dutamus, No. 1, Jalan Dutamas 1, Kuala Lumpur Malaysia",http://www.healymacs.com/,$$ - $$$,$$ - $$$IrishBarEuropean,+60 3-6203 1218,"Irish, Bar, European, Pub","Vegetarian Friendly, Vegan Options, Gluten Free Options"
El Cerdo,4.5 ,"43 & 45 Changkat Bukit Bintang, Kuala Lumpur 50200 Malaysia",http://www.elcerdokl.com/,$$ - $$$,$$ - $$$EuropeanSpanishGluten Free Options,+60 3-2145 0511,Gluten Free Options,"Lunch, Dinner, Brunch, Drinks"
Malai Thai Cuisine,4.5 ,"6 Jalan P Ramlee Menara Amplewest, Kuala Lumpur 50250 Malaysia",https://www.malaithai.restaurant/,$$ - $$$,$$ - $$$AsianThaiVegetarian Friendly,+60 3-2181 2505,"Asian, Thai","Vegetarian Friendly, Vegan Options, Gluten Free Options"
Yun House,4.5 ,"145 Jalan Ampang Four Seasons Hotel, Kuala Lumpur 50450 Malaysia",http://www.fourseasons.com/kualalumpur/dining/restaurants/yun-house/,$$$$,$$$$ChineseSeafoodCantonese,+60 3-2382 8640,"Chinese, Seafood","Vegetarian Friendly, Vegan Options, Gluten Free Options"
Vin's Restaurant and Bar,4.5 ,"No 6 Lorong Datuk Taman Tun Dr. Ismail, Kuala Lumpur 60000 Malaysia",http://www.vinsrestaurant.com/,$$ - $$$,$$ - $$$BarInternationalVegetarian Friendly,+60 12-200 2119,"Bar, International","Vegetarian Friendly, Vegan Options, Halal, Gluten Free Options"
Nook,4.5 ,"No 5 Jalan Stesen Sentral Aloft Kuala Lumpur Sentral, Kuala Lumpur 50470 Malaysia",http://www.aloftkualalumpursentral.com/en/nook,$$ - $$$,$$ - $$$InternationalAsianHealthy,+60 3-2723 1154,"Vegetarian Friendly, Vegan Options, Halal, Gluten Free Options","Breakfast, Lunch, Dinner, Brunch"
The Steakhouse KL,4.5 ,"44 Changkat Bukit Bintang, Kuala Lumpur 50200 Malaysia",http://steakhousekl.com/,$$ - $$$,$$ - $$$SteakhouseGluten Free Options,+60 12-735 6709,Gluten Free Options,"Dinner, Drinks"
Mai Bar,4.5 ,"No 5 Jalan Stesen Sentral Aloft Kuala Lumpur Sentral, Kuala Lumpur 50470 Malaysia",http://www.aloftkualalumpursentral.com/en/mai-bar,$$ - $$$,$$ - $$$BarPizzaWine Bar,+60 3-2723 1133,"Bar, Pizza, Wine Bar","Vegetarian Friendly, Gluten Free Options"
Quivo Pavilion,4.5 ,"Lot 3. 09. 02, Level 3, Pavilion 168, Jalan Bukit Bintang,, Kuala Lumpur 55100 Malaysia",http://quivo.my/,$$ - $$$,$$ - $$$ItalianBarPizza,+60 3-2141 7711,,
LUCE Osteria Contemporanea,4.5 ,"Old Malaya Lorong Raja Chulan No. 10, Old Malaya, Kuala Lumpur 50250 Malaysia",http://www.luceosteria.com/,$$ - $$$,$$ - $$$ItalianPizzaMediterranean,+60 3-2078 8008,"Italian, Pizza, Mediterranean, European, Healthy, Neapolitan, Campania, Southern-Italian","Vegetarian Friendly, Vegan Options, Gluten Free Options"
Toh Yuen Chinese Restaurant,4.5 ,"No 2 Jalan barat Hilton Petaling Jaya, Petaling Jaya 46200 Malaysia",http://eatdrinkhilton.com/toh-yuen-hiltonpj/#/,$$ - $$$,$$ - $$$ChineseSeafoodAsian,+60 3-7955 9122,"Chinese, Seafood, Asian","Vegetarian Friendly, Vegan Options, Halal, Gluten Free Options"
Aliyaa Island Restaurant & Bar,4.5 ,"48 G Jalan Medan Setia 2 Plaza Damasara, Bukit Damansara, Kuala Lumpur 50490 Malaysia",http://www.aliyaa.com/,$$ - $$$,$$ - $$$SeafoodAsianSri Lankan,+60 3-2092 5378,"Seafood, Asian, Sri Lankan","Vegetarian Friendly, Vegan Options, Halal, Gluten Free Options"
LOKL Coffee Co.,4.5 ,"30 Jalan Tun H S Lee, Kuala Lumpur 50100 Malaysia",http://www.instagram.com/loklcoffee/?hl=en,$$ - $$$,$$ - $$$CafeHealthyVegetarian Friendly,+60 18-968 5515,"Cafe, Healthy","Vegetarian Friendly, Vegan Options, Gluten Free Options"
BBQ NIGHTS,4.5 ,"Jalan P Ramlee Wisma Rohas PureCircle, Kuala Lumpur 50450 Malaysia",http://www.facebook.com/bbqnightskl,$$ - $$$,$$ - $$$IndianBarbecueAsian,+60 188725768,,
Kin Thai Restaurant,4.5 ,"Taman OUG, 58200 No 66 Jalan Hujan Rahmat 3 Taman Overseas Union Garden, Kuala Lumpur 58200 Malaysia",http://kinthai.my/,$$ - $$$,$$ - $$$SeafoodAsianThai,+60 12-956 3525,"Seafood, Asian, Thai, Soups","Lunch, Dinner, Brunch, Drinks"
Gravybaby Jalan P Ramlee,4.5 ,"12 Jalan P Ramlee, Kuala Lumpur 50250 Malaysia",https://www.gravybaby.com/our-stores/,$$ - $$$,$$ - $$$Fast foodEuropeanDiner,+60 14-357 0424,"Vegetarian Friendly, Vegan Options","Breakfast, Lunch, Dinner, Brunch"
Le Bar Cocktails & Stories,5.0 ,"Sofitel Kuala Lumpur Damansara 6 Jalan Damanlela Bukit Damansara, Kuala Lumpur 50490 Malaysia",http://www.sofitel-kualalumpur-damansara.com/restaurants-bars/le-bar/,$$ - $$$,$$ - $$$BarWine BarDining bars,+60 3-2720 6668,"After-hours, Drinks","Reservations, Seating, Parking Available, Valet Parking, Wheelchair Accessible, Serves Alcohol, Full Bar, Free Wifi, Accepts Credit Cards, Table Service, Wine and Beer, Non-smoking restaurants"
JP teres,4.5 ,"12 Jalan Pinang, Kuala Lumpur 50450 Malaysia",http://www.hyatt.com/en-US/hotel/malaysia/grand-hyatt-kuala-lumpur/kuagh/dining,$$ - $$$,$$ - $$$ChineseIndianAsian,+60 3-2203 9188,,
Eat X Dignity Cafe,4.5 ,"25-G, Jalan 11/48a, Sentul Raya Boulevard,, Kuala Lumpur 51000 Malaysia",http://dignityforchildren.org/what-we-do/enterprises/eat-x-dignity,$$ - $$$,$$ - $$$CafeAsianMalaysian,+60 3-2303 1366,"Cafe, Asian, Malaysian","Vegetarian Friendly, Vegan Options, Halal"
Knowhere Bangsar,5.0 ,"50 Jalan Maarof Bangsar, Kuala Lumpur 59100 Malaysia",http://www.knowheretoeat.com/en_MY/,$$ - $$$,$$ - $$$BarInternationalContemporary,+60 10-220 2358,"Bar, International, Contemporary, Fusion","Vegetarian Friendly, Vegan Options"
Tg's Nasi Kandar,4.5 ,"8 Jalan Tengkat Tong Shin Bukit Bintang, Kuala Lumpur 50200 Malaysia",http://www.facebook.com/tgsnasikandar,$,$IndianAsianMalaysian,+60 11-1055 6435,"Vegetarian Friendly, Vegan Options, Halal, Gluten Free Options","Breakfast, Lunch, Dinner, Brunch, After-hours"
THIRTY8,4.0 ,"12 Jalan Pinang, Kuala Lumpur 50450 Malaysia",http://www.hyatt.com/en-US/hotel/malaysia/grand-hyatt-kuala-lumpur/kuagh/dining,$$$$,$$$$InternationalDining barsVegetarian Friendly,+60 3-2182 1234,"International, Dining bars","Vegetarian Friendly, Vegan Options, Halal, Gluten Free Options"
Cafe:in House,4.5 ,"Unit 1-01, Level 1, Mercu Summer Suites, 8, Jalan Cendana, Kampung Baru,, Kuala Lumpur 50250 Malaysia",http://cafeinhouse2016.beepit.com/,$$ - $$$,$$ - $$$Quick BitesCafeEuropean,+60 12-750 6687,"Cafe, European","Breakfast, Lunch, Brunch, Drinks"
Curate At Four Seasons Hotel Kuala Lumpur,4.5 ,"145 Jalan Ampang, Kuala Lumpur 50450 Malaysia",http://www.fourseasons.com/kualalumpur/dining/restaurants/curate/,$$ - $$$,$$ - $$$InternationalAsianMiddle Eastern,+60 3-2382 7630,"International, Asian, Middle Eastern, Malaysian","Vegetarian Friendly, Vegan Options, Halal, Gluten Free Options"
Antipodean Atria,4.5 ,"Jalan Ss 22/23 Ground Floor, Atria Shopping Gallery, Petaling Jaya 47400 Malaysia",http://www.antipodeancoffee.com/,$$ - $$$,$$ - $$$CafeInternationalVegetarian Friendly,+60 3-7732 8594,"Cafe, International","Vegetarian Friendly, Vegan Options, Gluten Free Options"
Fuego at Troika Sky Dining,4.5 ,"Tower a Level 23a The Troika 19 Persiaran Klcc, Kuala Lumpur 50450 Malaysia",http://www.troikaskydining.com/fuego,$$ - $$$,$$ - $$$LatinCentral AmericanVegetarian Friendly,+60 3-2162 0886,,
Mosaic,4.5 ,"Kuala Lumpur City Centre (Klcc) Mandarin Oriental P.O.Box 10905, Kuala Lumpur 50088 Malaysia",https://www.mandarinoriental.com/en/kuala-lumpur/petronas-towers/dine/mosaic?src=loc.local_listing.mokul.yxt,$$$$,$$$$InternationalSushiMalaysian,+60 3-2179 8881,"Vegetarian Friendly, Vegan Options, Halal, Gluten Free Options","Breakfast, Lunch, Dinner, Brunch, After-hours"
El Toro Loco KL,5.0 ,"10 Jalan Perak Cormar Suites, Kuala Lumpur 50450 Malaysia",http://www.etlkl.com/,$$ - $$$,$$ - $$$BarMediterraneanSpanish,+60 3-2181 7388,,
Burger & Sushi,5.0 ,"Off Jalan Desa Pandan Jalan 1/76 Lot 06, Ground Floor G-Village, Kuala Lumpur 55100 Malaysia",http://www.facebook.com/Burgerandsushi.net,$$ - $$$,$$ - $$$JapaneseSushiAsian,+60 3-9226 9788,"Japanese, Sushi, Asian, Grill","Vegan Options, Gluten Free Options, Vegetarian Friendly"
Lai Po Heen,4.5 ,"Kuala Lumpur City Centre Mandarin Oriental, Kuala Lumpur 50088 Malaysia",https://www.mandarinoriental.com/en/kuala-lumpur/petronas-towers/dine/laipo-po-heen?src=loc.local_listing.mokul.yxt,$$$$,$$$$ChineseAsianCantonese,+60 3-2179-8977,,
Sao Nam Vietnamese Cuisine,4.5 ,"25 Tingkat Tong Shin, Kuala Lumpur 50200 Malaysia",http://www.saonam.com.my/,$$ - $$$,$$ - $$$VietnameseVegetarian FriendlyVegan Options,+60 3-2144 1225,,
Tamarind Hill Kuala Lumpur By Samadhi,4.5 ,"19 Jalan Sultan Ismail Bukit Bintang, Kuala Lumpur 50250 Malaysia",http://www.tamarindrestaurants.com/,$$$$,$$$$AsianThaiVegetarian Friendly,+60 3-2148 3200,"Asian, Thai","Vegetarian Friendly, Vegan Options, Gluten Free Options"
Din Tai Fung Pavilion KL,4.5 ,"168 Jalan Bukit Bintang Lot 6.01.05, Level 6, Kuala Lumpur 51000 Malaysia",http://dintaifung.oddle.me/en_MY,$$ - $$$,$$ - $$$ChineseAsianTaiwanese,+60 3-2148 8292,"Vegetarian Friendly, Vegan Options","Lunch, Dinner, Brunch"
Pinchos Tapas Bar,4.5 ,"18, Changkat Bukit Bintang, Kuala Lumpur 50200 Malaysia",http://www.pinchoskl.com/,$$ - $$$,$$ - $$$BarMediterraneanEuropean,+60 3-2145 8482,,
VCR,4.5 ,"2 Jalan Galloway, Kuala Lumpur 50150 Malaysia",http://vcr.my/,$$ - $$$,$$ - $$$Quick BitesAmericanEuropean,+60 3-2110 2330,"American, European, Australian","Vegetarian Friendly, Vegan Options, Gluten Free Options"
Ciccio Bar Pizzeria,4.5 ,"15 Changkat Bukit Bintang, Kuala Lumpur 50200 Malaysia",https://www.facebook.com/CiccioKL/,$$ - $$$,$$ - $$$ItalianNeapolitanCampania,+60 3-2141 8605,"Italian, Neapolitan, Campania, Romana, Lazio, Central-Italian, Southern-Italian","Vegetarian Friendly, Vegan Options"
Taps Beer Bar,4.5 ,"1 Jalan Nagasari A-0-3 One Residency |, Kuala Lumpur 50200 Malaysia",http://tapsbeerbar.my/,$$ - $$$,$$ - $$$BarPub,+60 3-2110 4836,"Bar, Pub","Dinner, After-hours, Drinks"
D Empire Pavilion,4.5 ,"168 Jalan Bukit Bintang Lot 6. 33 & 6. 34, Pavilion Kuala Lumpur, Kuala Lumpur 55100 Malaysia",http://www.dempirecuisine.com/,$$ - $$$,$$ - $$$SteakhouseEuropeanGrill,+60 3-2110 6196,"Steakhouse, European, Grill","Vegetarian Friendly, Vegan Options, Halal, Gluten Free Options"
Oro Cafe,5.0 ,"3 Jalan Stesen Sentral Hilton Kuala Lumpur, Kuala Lumpur 50470 Malaysia",http://www.eatdrinkhilton.com/oro-cafe/,$$ - $$$,$$ - $$$CafeInternationalAsian,+60 3-2264 2480,,
Feeka Coffee Roasters,4.5 ,"19 Jalan Mesui, Kuala Lumpur 50200 Malaysia",http://www.asianagegroup.com/,$$ - $$$,$$ - $$$Quick BitesCafeVegetarian Friendly,+60 3-2110 4599,Cafe,"Vegetarian Friendly, Vegan Options, Gluten Free Options"
Qureshi Malaysia,4.5 ,"1 Ground Floor, East Wing, TPC Kuala Lumpur , No 10 Jalan 1/70D Off Jalan Bukit Kiara, Kuala Lumpur 60000 Malaysia",http://www.qureshis.com/,$$$$,$$$$IndianAsianVegetarian Friendly,+60 17-244 0135,,
Samad Al Iraqi Restaurant,4.5 ,"No. 1 Jalan Pinang Unit G-3, G Floor, Menara Prestige, Kuala Lumpur 50450 Malaysia",http://www.samadaliraqirestaurant.com.my/,$$ - $$$,$$ - $$$InternationalHealthyArabic,+60 11-1110 0092,"Healthy, International, Arabic","Halal, Vegetarian Friendly, Vegan Options"
MTR 1924 Malaysia,4.5 ,"69 Jalan Thambipillai Brickfields, Kuala Lumpur 50470 Malaysia",http://mtrmalaysia.com/,$,$IndianAsianVegetarian Friendly,+60 3-2276 4924,"Indian, Asian","Vegetarian Friendly, Vegan Options, Gluten Free Options"
Blue,5.0 ,"Equatorial Plaza, Jalan Sultan Ismail Sky51, Kuala Lumpur 50250 Malaysia",https://www.eqkualalumpur.com/dining/blue,$$ - $$$,$$ - $$$BarInternationalWine Bar,+60 3-2789 7777,"Bar, International, Wine Bar, Dining bars","After-hours, Drinks"
Antipodean Tan & Tan,4.5 ,"207 Jalan Tun Razak Menara Tan & Tan, Kuala Lumpur 50450 Malaysia",http://www.antipodeancoffee.com/,$$ - $$$,$$ - $$$CafeInternationalEuropean,+60 3-2161 0752,"European, New Zealand, Cafe, International","Vegetarian Friendly, Vegan Options, Gluten Free Options"
"Nam Heong Vintage, Pavilion Elite",4.5 ,"Lot 106.00 Jalan Bukit Bintang Level 8, Pavilion Elite Mall, Kuala Lumpur 55100 Malaysia",http://www.namheongipoh.com/,$,$CantoneseMalaysianVegetarian Friendly,+60 3-2110 6321,Malaysian,"Vegetarian Friendly, Vegan Options, Gluten Free Options"
myBurgerLab,4.5 ,"14 Jalan 21/22 Seapark, Petaling Jaya 46300 Malaysia",http://www.facebook.com/myBurgerLab,$$ - $$$,$$ - $$$American,,"Dinner, After-hours","Takeout, Seating, Accepts Credit Cards"
Tosca,4.5 ,"The DoubleTree Hotel The Intermark, 182 Jalan Tun Razak, Kuala Lumpur 50400 Malaysia",http://www.eatdrinkhilton.com/tosca-doubletreekl/,$$ - $$$,$$ - $$$ItalianPizzaMediterranean,+60 12-290 4551,"Italian, Pizza, Mediterranean, European, Dining bars","Vegetarian Friendly, Vegan Options"
Betel Leaf,4.5 ,"Lebuh Ampang, Kuala Lumpur 50100 Malaysia",http://www.betel-leaf.com/,$$ - $$$,$$ - $$$IndianAsianVegetarian Friendly,+60 3-2032 5932,"Indian, Asian","Vegetarian Friendly, Vegan Options, Halal, Gluten Free Options"
Sassorosso,4.5 ,"9 Lorong Yap Kwan Seng, Kuala Lumpur 50450 Malaysia",,$$$$,$$$$ItalianPizzaMediterranean,+60 3-2166 6428,"Vegetarian Friendly, Vegan Options","Lunch, Dinner, After-hours"
Sushi Hibiki,5.0 ,"G7, Ground Floor, Four Seasons Place 145, Jalan Ampang, Kuala Lumpur 50450 Malaysia",http://hibiki4s.me/,$$$$,$$$$JapaneseSeafoodSushi,+60 3-2383 0272,,
Antipodean Bangsar,4.0 ,"20 Jalan Telawi 2 Bangsar Baru, Kuala Lumpur 59100 Malaysia",http://www.antipodeancoffee.com/index.php/ac-our-cafes/antipodean-bangsar,$$ - $$$,$$ - $$$CafeInternationalVegetarian Friendly,+60 3-2282 0411,"Cafe, International","Vegetarian Friendly, Vegan Options, Gluten Free Options"
IPPUDO Pavilion KL,4.0 ,"Pavilion KL Connection Level 4, Pavilion KL, Kuala Lumpur 55100 Malaysia",http://www.ippudo.com.my/store-location/#thegardens,$$ - $$$,$$ - $$$JapaneseAsianSoups,+60 3-2110 6233,"Japanese, Asian, Soups","Lunch, Dinner, Drinks"
Marini's on 57,4.0 ,"Level 57, Menara 3 Petronas Persiaran Klcc, Kuala Lumpur 50088 Malaysia",http://www.marinis57.com/,$$$$,$$$$ItalianEuropeanContemporary,+60 3-2386 6030,"Italian, European, Contemporary",Vegetarian Friendly
THE TOKYO RESTAURANT.,4.5 ,"50 Jalan Sultan Ismail Lot 10, 4th Floor, ISETAN The Japan Store, Kuala Lumpur 50250 Malaysia",http://www.isetankl.com.my/the-tokyo-restaurant/,$$ - $$$,$$ - $$$JapaneseFusionVegetarian Friendly,+60 3-2119 2622,"Japanese, Fusion","Vegetarian Friendly, Vegan Options"
myBurgerLab,4.5 ,"3 Jalan Pjs 11/9, Petaling Jaya 46150 Malaysia",http://myburgerlab.com/,$$ - $$$,$$ - $$$Quick BitesAmericanFast food,+60 10-369 5275,"Vegetarian Friendly, Halal","Lunch, Dinner"
Green Tomato Cafe,4.5 ,"Jalan Tiara Kemensah 3 51 Embun Kemensah, Kuala Lumpur 55000 Malaysia",https://www.facebook.com/greentomatocafe.com.my,$$ - $$$,$$ - $$$AmericanPizzaCafe,+60 12-257 9775,"American, Pizza, Cafe","Vegetarian Friendly, Vegan Options, Halal"
Tamarind Springs By Samadhi,4.0 ,"Jalan 1 Ampang, Selangor, Kuala Lumpur 68000 Malaysia",http://www.samadhiretreats.com/tamarind-springs.html,$$$$,$$$$AsianThaiMalaysian,+60 3-4256 9300,"Cambodian, Asian, Thai, Malaysian","Vegetarian Friendly, Vegan Options, Halal, Gluten Free Options"
Bijan,4.0 ,"3 Jln Ceylon Golden Triangle, Kuala Lumpur Malaysia",http://www.bijanrestaurant.com/,$$ - $$$,$$ - $$$AsianMalaysianVegetarian Friendly,+60 3-2031 6568,"Vegetarian Friendly, Vegan Options, Halal, Gluten Free Options","Dinner, After-hours"
2OX Two Ox,4.5 ,"56G Jalan Doraisamy The Row, Kuala Lumpur 50300 Malaysia",http://www.two-ox.com/,$$ - $$$,$$ - $$$FrenchEuropeanVegetarian Friendly,+60 3-2692 2233,"French, European","Vegetarian Friendly, Vegan Options, Gluten Free Options"
WXYZ Bar,4.5 ,"No 6 Jalan Stesen Sentral Aloft Kuala Lumpur Sentral, Kuala Lumpur 50470 Malaysia",http://www.facebook.com/pg/AloftKualaLumpurSentral/services/,$$ - $$$,$$ - $$$BarPubVegetarian Friendly,+60 3-2723 1188,Vegetarian Friendly,"Breakfast, Lunch, Dinner"
Village Park Restaurant,4.0 ,"5 Jalan Ss 21/37 Damansara Utama, Petaling Jaya 47400 Malaysia",https://www.facebook.com/Village-Park-Restaurant-1639483826264341/?hc_ref=ARQsO73DflHE6sy9Kjih-ckfUql10bjEk1K5nwc45sCtp9z33cSZGiAYpCvnykRmyJ0&fref=nf,$$ - $$$,$$ - $$$AsianMalaysianHalal,+60 3-7710 7860,Halal,"Breakfast, Lunch, Brunch"
Restoran Yusoof dan Zakhir,4.0 ,"Jalan Hang Kasturi No. 40, Ground Floor, Kuala Lumpur 50050 Malaysia",https://www.facebook.com/pages/Restoran-Yusoof-Dan-Zakhir/172374629574479,$,$IndianAsianMalaysian,+60 3-2026 8685,"Vegetarian Friendly, Halal, Vegan Options","Breakfast, Lunch, Dinner, Brunch, After-hours"
myBurgerLab Oug,4.5 ,"8 Jalan Awan Hijau Taman Oug, Kuala Lumpur 58200 Malaysia",http://myburgerlab.com/,$$ - $$$,$$ - $$$AmericanFast foodVegetarian Friendly,+60 3-7499 4855,"Vegetarian Friendly, Vegan Options, Halal","Lunch, Dinner"
AQUA Restaurant & Bar,4.5 ,"Kuala Lumpur City Centre (KLCC) Kuala Lumpur City Centre, Kuala Lumpur 50088 Malaysia",https://www.mandarinoriental.com/en/kuala-lumpur/petronas-towers/dine/aqua-restaurant-and-bar?src=loc.local_listing.mokul.yxt,$$ - $$$,$$ - $$$AmericanBarInternational,+60 3-2380-8888,,
Nori Sushi,4.5 ,"10 Jalan Perak Cormar Suites, Kuala Lumpur 50450 Malaysia",http://www.norisushi.restaurant/,$$ - $$$,$$ - $$$JapaneseSeafoodSushi,+60 3-2181 4873,"Japanese, Seafood, Sushi, Asian","Vegetarian Friendly, Gluten Free Options"
Via Pre Kul,4.5 ,"25 Lorong Setiabistari 2 Bukit Damansara, Kuala Lumpur 50490 Malaysia",https://www.facebook.com/viaprekul/,$$ - $$$,$$ - $$$ItalianPizzaSeafood,+60 3-2011 2003,"Italian, Mediterranean, Pizza, Tuscan, Central-Italian, Seafood, European","Vegetarian Friendly, Vegan Options, Gluten Free Options"
Jersey Jack Gelato,4.5 ,"49 Jalan Berangan, Kuala Lumpur 50200 Malaysia",http://www.facebook.com/JerseyJackGelatoKL,$$ - $$$,$$ - $$$Dessert,+60 12-327 0785,"Takeout, Outdoor Seating, Seating, Street Parking, Cash Only, Free Wifi",
