Name,Rating,Address,URL,Price,Type,Phone,Cousine
Mama Noodle Cafe,4.0 ,"132 Hala Wah Keong Taman Mirindi, Ipoh 31400 Malaysia",,Chinese,Chinese,+60 16-591 7188,Breakfast
Restoran Oldfriend,5.0 ,"1 Jalan Chemor Hulu Kinta, Chemor 31200 Malaysia",,Chinese,Chinese,,
Ray of Hope Ipoh,4.5 ,"24 & 26 Persiaran Bercham Selatan 31 Taman Sri Kurau, Bercham, Ipoh 31400 Malaysia",,Cafe,CafeAsianMalaysian,6055488796,"Breakfast, Lunch"
"Allongs, Warong Ipoh Lontong",4.0 ,"24 Pesara Ipoh 1, Ipoh 31400 Malaysia",,Asian,AsianMalaysian,+60 18-466 6238,
Fu Man Lou Home Cuisine,5.0 ,"6 Jalan Seenivasagam, Ipoh 31200 Malaysia",https://fu-man-lou-restaurant.business.site/?utm_source=gmb&utm_medium=referral,Asian,AsianMalaysian,+60 16-686 7011,"Lunch, Dinner"
Restoran Vegas,3.5 ,"1 Lorong Cecil Rae Canning Garden, Lebuh Cecil Rae, Ipoh 31400 Malaysia",,$,$Malaysian,+60 12-528 2848,
Chan Burger Stall,5.0 ,"1390, Jalan Queen, Kampung Pasir Pinji Baru, 31650, Ipoh 31650 Malaysia",,Quick Bites,Quick BitesFast food,,
Vintage Coffee and Bread,4.0 ,"111 Jalan Theatre, Ipoh 30300 Malaysia",,Cafe,Cafe,+60 12-837 6618,"Breakfast, Lunch"
Olivenz Cafe,3.5 ,"65 Jalan Medan Ipoh 3 Bandar Baru Medan Ipoh, Ipoh 31400 Malaysia",,$$ - $$$,$$ - $$$Steakhouse,+60 5-545 5099,
